{
  "shot_id": "shot-marvin-road-001",
  "world_id": "earth2-three-cell",
  "parent_world_hash": "sha256:768ef690dfbef0d066cc53bb699e39fed1492b227e6cd0602f6fc078912fb673",
  "proposer": "claude-fable-5-1 (rung 2 of the demo ladder)",
  "created_at": "2026-09-04T22:20:00Z",
  "status": "accepted",
  "accepted_by": "fixture-human-reviewer",
  "accepted_at": "2026-09-04T22:21:00Z",
  "seed": 42,
  "rationale": "Rung 2: the simplest Marvin, a card cut from the puppet rig, walks up the road from the river into the town, stops, says a line, and walks on. Proves a Shot Plan through the chain without a real rig.",
  "rights_manifest_id": "rights-three-cells-marvin-001",
  "performer": {
    "asset": "marvin-card",
    "rights_item_id": "marvin-puppet-card",
    "height_m": 1.55
  },
  "path": {
    "kind": "road-spine",
    "from_m": 2.0,
    "speed_mps": 1.3
  },
  "duration_s": 8.0,
  "fps": 24,
  "beats": [
    {
      "at_s": 0.0,
      "do": "walk"
    },
    {
      "at_s": 3.0,
      "do": "stop"
    },
    {
      "at_s": 3.3,
      "do": "say",
      "text": "They built a town by a river and gave me the road. Marvellous.",
      "seconds": 2.3
    },
    {
      "at_s": 5.8,
      "do": "walk"
    }
  ],
  "camera": {
    "mode": "follow",
    "distance_m": 5.0,
    "height_m": 1.7,
    "lens_mm": 35
  }
}